{
  "$schema": "https://flagfit.pro/schemas/knowledge_base/v1.0.0",
  "schema_version": "1.0.0",
  "content_version": "1.0.0",
  "document_id": "urn:uuid:967b17c1-1dc6-4cef-8c53-0c9f2eee906d",
  "generated_at": "2026-02-10T18:25:06.296Z",
  "reviewed_at": null,
  "rights": {
    "is_open_access": false,
    "licence_expression": "LicenseRef-Proprietary",
    "permitted_use": "internal_only",
    "attribution": {
      "title": "Practitioner's Guide to Preseason - 2025 Edition",
      "publisher": "VALD Performance",
      "source_url": "https://resources.valdperformance.com",
      "authors": ["VALD Performance Contributors"]
    }
  },
  "metadata": {
    "title": "Practitioner's Guide to Preseason - 2025 Edition",
    "authors": ["VALD Performance Contributors"],
    "total_pages": 49,
    "document_type": "practitioner_guide"
  },
  "research_article": {
    "title": "Practitioner's Guide to Preseason - 2025 Edition",
    "authors": ["VALD Performance Contributors"],
    "publication_year": 2025,
    "publisher": "VALD Performance",
    "primary_category": "training",
    "categories": [
      "training",
      "periodization",
      "load_management",
      "assessment",
      "team_sports"
    ],
    "tags": [
      "preseason",
      "periodization",
      "training_planning",
      "load_management",
      "testing",
      "team_sports",
      "ACWR"
    ],
    "study_type": "review",
    "evidence_level": "B",
    "sport_type": "team_sports",
    "key_findings": "Comprehensive preseason planning guide covering periodization principles, progressive loading strategies, baseline testing protocols, and athlete readiness monitoring. Emphasizes balancing fitness development with skill work while managing injury risk through appropriate load progression.",
    "practical_applications": [
      "Structure preseason using periodization principles",
      "Implement comprehensive baseline testing battery",
      "Manage training loads with ACWR monitoring",
      "Progress loads appropriately (10% rule)",
      "Monitor athlete readiness and wellness",
      "Balance physical and technical development",
      "Prepare athletes systematically for competition"
    ],
    "training_types": [
      "periodization",
      "strength",
      "conditioning",
      "load_management"
    ],
    "is_open_access": false,
    "verified": true,
    "quality_score": 9,
    "keywords": [
      "preseason",
      "periodization",
      "training_planning",
      "load_management",
      "testing",
      "ACWR"
    ]
  },
  "knowledge_base_entries": [
    {
      "entry_type": "training_method",
      "topic": "preseason_periodization",
      "question": "How should preseason training be structured and periodized?",
      "answer": "Preseason training follows periodization principles with distinct phases: general preparation (building base fitness), specific preparation (sport-specific development), and competition preparation (tapering and sharpening). Volume starts high and decreases while intensity progressively increases. Include strength, power, speed, and conditioning work integrated with technical-tactical training.",
      "summary": "Preseason periodization progressively builds from general preparation through specific preparation to competition readiness.",
      "evidence_strength": "strong",
      "consensus_level": "high",
      "applicable_to": ["team_sport_athletes", "field_sport_athletes"],
      "sport_specificity": "team_sports",
      "categories": ["training", "periodization"],
      "tags": ["preseason", "periodization", "training_planning", "phases"],
      "protocols": {
        "phases": [
          "general_preparation",
          "specific_preparation",
          "competition_preparation"
        ],
        "duration": "6-12_weeks_typical",
        "volume_progression": "high_to_moderate",
        "intensity_progression": "moderate_to_high"
      },
      "best_practices": [
        "Follow periodization principles (volume then intensity)",
        "Include distinct training phases",
        "Progressive load increases",
        "Balance physical and skill development",
        "Individualize based on athlete readiness",
        "Plan recovery and regeneration weeks"
      ],
      "entry_id": "urn:uuid:e82cd736-7717-4a2f-89ca-945febd9d38b",
      "evidence_framework": "GRADE"
    },
    {
      "entry_type": "training_method",
      "topic": "preseason_testing_assessment",
      "question": "What testing should be conducted during preseason?",
      "answer": "Preseason testing establishes baselines for strength (force plates, isometric testing), power (jumps, throws), speed (sprint times), and aerobic capacity. Include injury risk screening (movement quality, asymmetries). Testing identifies individual strengths, weaknesses, and training priorities. Repeat key tests mid-season to track adaptation.",
      "summary": "Comprehensive preseason testing establishes baselines and identifies individual training needs across multiple physical qualities.",
      "evidence_strength": "strong",
      "consensus_level": "high",
      "applicable_to": ["team_sport_athletes", "elite_athletes"],
      "sport_specificity": "team_sports",
      "categories": ["assessment", "testing"],
      "tags": [
        "testing",
        "assessment",
        "baseline",
        "screening",
        "force_plates"
      ],
      "protocols": {
        "test_battery": [
          "strength",
          "power",
          "speed",
          "aerobic_capacity",
          "movement_screening"
        ],
        "timing": "early_preseason_for_baseline",
        "retest": "mid_season_and_postseason"
      },
      "best_practices": [
        "Conduct comprehensive baseline testing early",
        "Use sport-specific assessments",
        "Test strength, power, speed, and endurance",
        "Include injury risk screening",
        "Establish individual training priorities from results",
        "Track longitudinal changes"
      ],
      "entry_id": "urn:uuid:ba47f85f-f61b-488c-95d9-238021c9b767",
      "evidence_framework": "GRADE"
    },
    {
      "entry_type": "training_method",
      "topic": "preseason_load_management",
      "question": "How should training load be managed during preseason?",
      "answer": "Preseason load management requires monitoring acute:chronic workload ratios (ACWR), staying in the 0.8-1.3 range. Progress loads by no more than 10% per week. Monitor session RPE, wellness markers, and readiness scores. Include planned deload weeks. Individualize based on training age and injury history. Avoid load spikes that increase injury risk.",
      "summary": "Preseason load management uses ACWR monitoring and progressive loading (10% rule) to build capacity while managing injury risk.",
      "evidence_strength": "strong",
      "consensus_level": "high",
      "applicable_to": ["team_sport_athletes", "elite_athletes"],
      "sport_specificity": "team_sports",
      "categories": ["load_management", "monitoring"],
      "tags": [
        "load_management",
        "ACWR",
        "recovery",
        "monitoring",
        "injury_prevention"
      ],
      "protocols": {
        "acwr_target_range": "0.8-1.3",
        "weekly_load_increase": "max_10_percent",
        "monitoring_tools": ["session_RPE", "wellness", "readiness"]
      },
      "best_practices": [
        "Monitor acute:chronic workload ratios (0.8-1.3)",
        "Progress loads by maximum 10% per week",
        "Track session RPE and wellness markers",
        "Include planned deload/recovery weeks",
        "Individualize based on athlete training history",
        "Avoid load spikes (ACWR >1.5)",
        "Balance team and individual training needs"
      ],
      "entry_id": "urn:uuid:71a759a0-5157-44f5-9e4c-97260f93167e",
      "evidence_framework": "GRADE"
    }
  ]
}
